{
    "meeting_id":  "MEET-20260608-115156-conversation-ux",
    "topic":  "Conversation 페이지가 이제 새 대화와 이어가기를 구분하기 쉬운지 검토해줘. 구현하지 말고 UX 관점 의견만 줘.",
    "meeting_type":  "technical",
    "participants":  [
                         "executive_producer",
                         "game_designer",
                         "tools_engineer"
                     ],
    "chair_agent_id":  "executive_producer",
    "director_user_id":  "human_director",
    "agenda":  [
                   "Human Director가 채팅으로 시작한 자유 대화입니다."
               ],
    "known_constraints":  [
                              "소스/실행 항목/git 자동 변경 금지",
                              "자동 구현 실행 금지",
                              "후보 생성 전 Human Director 확인"
                          ],
    "loaded_context_refs":  [

                            ],
    "discussion_turns":  [
                             {
                                 "turn_id":  "turn-001",
                                 "speaker_id":  "human_director",
                                 "turn_type":  "synthesis",
                                 "content":  "Conversation 페이지가 이제 새 대화와 이어가기를 구분하기 쉬운지 검토해줘. 구현하지 말고 UX 관점 의견만 줘.",
                                 "source_refs":  [

                                                 ]
                             },
                             {
                                 "turn_id":  "turn-002",
                                 "speaker_id":  "executive_producer",
                                 "turn_type":  "synthesis",
                                 "content":  "현재 패킷에는 Conversation 페이지의 화면, 흐름, 문구, 상태 구분 방식에 대한 근거가 없어 새 대화와 이어가기가 실제로 구분하기 쉬운지 판단할 수 없습니다. UX 의견은 화면 증거를 받은 뒤, 구현 제안이 아닌 회의용 관찰 의견으로만 정리하는 것이 적절합니다.\n제안: 증거 기반 UX 검토로 범위 제한\n승인 필요: 이번 기여 범위를 구현 없는 UX 의견으로만 유지할지 확인이 필요합니다.\n남은 질문: 현재 Conversation 페이지의 스크린샷이나 화면 흐름 설명을 제공해도 될까요?\n우려/반론: 현재 자료만으로는 UX 판단을 완료할 수 없습니다.",
                                 "source_refs":  [

                                                 ]
                             }
                         ],
    "proposals":  [

                  ],
    "objections":  [

                   ],
    "unresolved_questions":  [

                             ],
    "director_decisions":  [

                           ],
    "accepted_directions":  [

                            ],
    "rejected_directions":  [

                            ],
    "follow_up_workorders":  [

                             ],
    "minutes_artifact":  "_Docs/AIWorkflow/Studio/MeetingSessions/MEET-20260608-115156-conversation-ux.json",
    "status":  "in_progress"
}
