{
    "meeting_id":  "MEET-20260520-120958-director-goal-planning-studio-ux-imp",
    "topic":  "Director goal planning: Studio UX improvement goal: Home 화면에서 Human Director가 지금 판단해야 할 일, 최근 작업 상태, 다음 행동을 더 직관적으로 이해할 수 있게 개선 방향을 기획해줘.",
    "meeting_type":  "technical",
    "participants":  [
                         "executive_producer",
                         "technical_architect",
                         "gameplay_programmer",
                         "qa_tester"
                     ],
    "chair_agent_id":  "executive_producer",
    "director_user_id":  "human_director",
    "agenda":  [
                   "감독자 목표를 한 문장으로 재정의합니다.",
                   "필요한 부서와 AI 직원 역할을 나눕니다.",
                   "승인이 필요한 선택지를 분리합니다.",
                   "후속 WorkOrder 후보를 정리합니다."
               ],
    "known_constraints":  [
                              "구현은 하지 말고",
                              "필요한 부서/AI 직원 역할",
                              "제안안",
                              "승인 필요 항목",
                              "후속 WorkOrder 후보만 정리해줘. Discord 기능은 이번 범위에서 제외해."
                          ],
    "loaded_context_refs":  [
                                "DGP-20260520-120958-studio-ux-improvement-goal-home-huma",
                                "dustland_custom_cpp_prototype"
                            ],
    "discussion_turns":  [
                             {
                                 "turn_id":  "turn-001",
                                 "speaker_id":  "technical_architect",
                                 "turn_type":  "synthesis",
                                 "content":  "기술 아키텍트 관점에서는 Studio Home을 단순한 첫 화면이 아니라 Human Director가 현재 상태, 판단 필요 항목, 다음 행동을 한눈에 확인하는 운영 대시보드로 정의하는 것이 적절합니다. 다만 실제 구현 범위와 화면 구성 확정에는 기존 Studio 구조와 사용 흐름에 대한 추가 근거가 필요합니다.\n제안: TechnicalDesignBrief; ImplementationConstraints; ValidationPlan\n승인 필요: Home 화면 개선의 첫 구현 범위를 읽기 전용 운영 대시보드로 제한할지 Director 결정이 필요합니다.\n남은 질문: Home 화면에서 우선 표시해야 하는 Director 판단 항목은 승인 대기, 증거 부족, 차단 상태, 다음 WorkOrder 후보 중 무엇입니까?; 이번 목표의 첫 단계는 읽기 전용 대시보드입니까, 아니면 기존 승인 흐름으로 이동하는 버튼까지 포함합니까?; 최근 작업 현황은 WorkOrder 기준으로 볼지, ActiveTask 기준으로 볼지, 실행 세션 기준으로 볼지 결정이 필요합니다.\n우려/반론: 이번 회의에서 Home 화면의 최종 사양을 확정하는 것은 이르다고 봅니다.; Home 화면이 실행 기능을 직접 소유하는 설계는 피해야 합니다.",
                                 "source_refs":  [

                                                 ]
                             }
                         ],
    "proposals":  [

                  ],
    "objections":  [

                   ],
    "unresolved_questions":  [

                             ],
    "director_decisions":  [

                           ],
    "accepted_directions":  [

                            ],
    "rejected_directions":  [

                            ],
    "follow_up_workorders":  [

                             ],
    "minutes_artifact":  "_Docs/AIWorkflow/Studio/MeetingSessions/MEET-20260520-120958-director-goal-planning-studio-ux-imp.json",
    "status":  "in_progress"
}
