{
    "meeting_id":  "MEET-20260520-151455-studio-home",
    "topic":  "Studio Home 화면에 필요한 기능 논의",
    "meeting_type":  "technical",
    "participants":  [
                         "executive_producer",
                         "documentation_keeper",
                         "tools_engineer",
                         "qa_tester"
                     ],
    "chair_agent_id":  "executive_producer",
    "director_user_id":  "human_director",
    "agenda":  [
                   "Studio Home 화면에 필요한 기능이 어떤 것들이 있을지 논의 후 스펙 고정",
                   "문서화",
                   "마일스톤 설정"
               ],
    "known_constraints":  [
                              "워크플로우 룰에 따름"
                          ],
    "loaded_context_refs":  [

                            ],
    "discussion_turns":  [
                             {
                                 "turn_id":  "turn-001",
                                 "speaker_id":  "documentation_keeper",
                                 "turn_type":  "synthesis",
                                 "content":  "?뚯쓽 二쇱젣? ?덇굔 ?쇰?媛 ?몄퐫???먯긽?쇰줈 ?쎌쓣 ???녾퀬, ?곌껐??source of truth??evidence_refs媛 ?놁뼱 documentation_keeper 愿?먯쓽 ?뚯쓽 湲곗뿬?덉쓣 ?뺤젙?????놁뒿?덈떎.\n제안: DocumentationUpdate; GuideUpdateDecision\n남은 질문: ?뺤긽 ?몄퐫?⑸맂 ?뚯쓽 二쇱젣? 媛??덇굔???ㅼ떆 ?쒓났??二쇱꽭??; Studio Home 愿??source of truth 臾몄꽌 寃쎈줈 ?먮뒗 evidence_refs瑜?吏?뺥빐 二쇱꽭??\n우려/반론: ?낅젰???뚯쓽 二쇱젣? ?덇굔 ?쇰?媛 ?쎌쓣 ???녿뒗 ?곹깭?낅땲??; source of truth? evidence_refs媛 ?쒓났?섏? ?딆븯?듬땲??",
                                 "source_refs":  [

                                                 ]
                             },
                             {
                                 "turn_id":  "turn-002",
                                 "speaker_id":  "tools_engineer",
                                 "turn_type":  "synthesis",
                                 "content":  "tools_engineer 관점의 회의 기여안입니다. Studio Home 화면은 작업 현황을 한눈에 보고, 승인 대기와 실행 상태를 안전하게 구분하며, 다음 행동을 명확히 안내하는 운영 대시보드가 되어야 합니다.\n제안: Studio Home 핵심 화면 구성; 안전 플래그 가시화; 승인 대기 중심의 다음 행동 안내; 도구 실행 계획 표시; 사용자 가이드 업데이트 결정\n승인 필요: Studio Home의 필수 기능 목록을 공식 기준으로 확정하려면 Human Director의 canon 승인이 필요합니다.\n남은 질문: Studio Home의 1차 사용자는 Human Director 한 명인가요, 아니면 여러 역할의 staff agent 상태도 함께 보는 운영 화면인가요?; Studio Home에서 보여줄 상태의 기준은 WorkOrder 중심인가요, ActiveTask 중심인가요, RoleRun 중심인가요?\n우려/반론: Studio Home에서 완료 판정이나 검증 통과 여부를 자동으로 확정하는 기능은 현재 회의 기여 범위를 넘습니다.; 홈 화면에서 commit, push, mark done을 직접 수행하는 기능은 이번 안건에서 결정하면 안 됩니다.",
                                 "source_refs":  [

                                                 ]
                             },
                             {
                                 "turn_id":  "turn-003",
                                 "speaker_id":  "qa_tester",
                                 "turn_type":  "synthesis",
                                 "content":  "QA 관점의 회의 기여안입니다. Studio Home 화면은 보기 좋은 첫 화면보다, 현재 워크플로 상태와 다음에 해야 할 일을 Human Director가 빠르게 확인하고 판단할 수 있는 검증 가능한 작업 관제 화면이어야 합니다.\n제안: QAReport; VerificationNotes; RemainingRisks\n남은 질문: Studio Home의 1차 목적은 프로젝트 현황 요약입니까, WorkOrder 실행 관제입니까, 아니면 Human Director의 다음 행동 선택 화면입니까?; Studio Home에서 완료와 검증 완료를 별도 상태로 보여줄 예정입니까?\n우려/반론: Studio Home을 단순한 요약 화면으로만 설계하는 것은 QA 관점에서 위험합니다.; evidence 없이 상태를 완료처럼 보이게 하는 표현은 피해야 합니다.",
                                 "source_refs":  [

                                                 ]
                             },
                             {
                                 "turn_id":  "turn-004",
                                 "speaker_id":  "documentation_keeper",
                                 "turn_type":  "synthesis",
                                 "content":  "회의 기여 초안은 작성할 수 있지만, WorkOrder의 핵심 주제와 일부 의제가 깨진 문자로 전달되어 최종 기여문으로 확정하면 안 됩니다. 현재 상태에서는 Studio Home 화면에 필요한 문서·워크플로우 중심 정보 구조에 대한 초안 의견만 제안합니다.\n제안: DocumentationUpdate: Studio Home 화면 회의 기여 초안; 시각화 제안; GuideUpdateDecision: 사용자 가이드 업데이트 판단; KnownRisks: 문서 근거 부족\n남은 질문: 깨진 의제 문장을 원문 한국어로 다시 제공해 주시겠습니까?; Studio Home의 기준 source of truth 문서는 어느 파일입니까?\n우려/반론: WorkOrder의 핵심 주제와 일부 의제가 깨진 문자로 전달되었습니다.; source of truth가 연결되어 있지 않습니다.",
                                 "source_refs":  [

                                                 ]
                             }
                         ],
    "proposals":  [

                  ],
    "objections":  [

                   ],
    "unresolved_questions":  [

                             ],
    "director_decisions":  [

                           ],
    "accepted_directions":  [

                            ],
    "rejected_directions":  [

                            ],
    "follow_up_workorders":  [

                             ],
    "minutes_artifact":  "_Docs/AIWorkflow/Studio/MeetingSessions/MEET-20260520-151455-studio-home.json",
    "status":  "in_progress"
}
